{
  "tool_id": "aif-exec-record",
  "version": "0.1.0",
  "description": "Command execution wrapper that emits a canonical AIF-0.1 ExecutionRecord separating PROCESS_RESULT, TEST_RESULT, and SEMANTIC_RESULT (AIF-004, AIF-004A, AIF-005, AIF-005A).",
  "capability_class": "PROCESS_EXECUTION",
  "side_effects": {
    "mutates_repository": true,
    "network_access": true,
    "spawns_persistent_process": false
  },
  "required_authority": "EXECUTE_SANDBOX_COMMAND",
  "observability": {
    "emits_signals": [
      "exit_code",
      "stdout",
      "stderr",
      "structured_metadata"
    ],
    "produces_verification_directly": false,
    "known_blind_spots": [
      "Semantic sufficiency relative to a Claim requires downstream EvidenceCoverage evaluation (AIF-007)"
    ]
  }
}
