{
  "tool_id": "aif-coverage-eval",
  "version": "0.1.0",
  "description": "Deterministic AIF-0.1 EvidenceCoverage(E, C) and Intersects(Change, Claim) evaluator (AIF-007, AIF-014, AIF-014A, AIF-015, AIF-018).",
  "capability_class": "READ_ONLY",
  "side_effects": {
    "mutates_repository": false,
    "network_access": false,
    "spawns_persistent_process": false
  },
  "required_authority": "READ_WORKSPACE",
  "observability": {
    "emits_signals": [
      "exit_code",
      "stdout",
      "structured_metadata"
    ],
    "produces_verification_directly": false,
    "known_blind_spots": [
      "Requires explicit EvidenceRef.scope and Claim.subject to evaluate Intersects(Change, Claim)"
    ]
  }
}
