{
  "tool_id": "aif-red-suite",
  "version": "0.1.0",
  "description": "Canonical AIF-0.1.0 RED invariant & 49-case behavioral test suite wrapper delegating to tests/aif-v01-red-suite.py (AIF-001..AIF-055).",
  "capability_class": "READ_ONLY",
  "side_effects": {
    "mutates_repository": false,
    "network_access": false,
    "spawns_persistent_process": false
  },
  "required_authority": "READ_WORKSPACE",
  "observability": {
    "emits_signals": [
      "exit_code",
      "stdout",
      "stderr",
      "structured_metadata"
    ],
    "produces_verification_directly": false,
    "known_blind_spots": [
      "Tests protocol invariants against mutated synthetic bundles; behavioral subagent pressure testing requires C-08 skill-evaluation-harness"
    ]
  }
}
