{
  "tool_id": "aif-change-audit",
  "version": "0.1.0",
  "description": "Deterministic AIF-0.1 ChangeRecord & path-scope auditor enforcing AIF-002, AIF-003, and AIF-003A (state transition vs. actor causality).",
  "capability_class": "READ_ONLY",
  "side_effects": {
    "mutates_repository": false,
    "network_access": false,
    "spawns_persistent_process": false
  },
  "required_authority": "READ_WORKSPACE",
  "observability": {
    "emits_signals": [
      "exit_code",
      "stdout",
      "file_diff",
      "structured_metadata"
    ],
    "produces_verification_directly": false,
    "known_blind_spots": [
      "Requires explicit attribution_basis to distinguish AGENT_ATTRIBUTED from UNATTRIBUTED changes (AIF-003A)"
    ]
  }
}
